{
  "schemaVersion": 2,
  "owner": "vigilanty0x",
  "scope": "PUBLIC_ONLY",
  "generatedAt": "2026-09-06T14:57:18Z",
  "observedAt": "2026-09-06T14:51:35.617Z",
  "expiresAt": "2026-10-06T14:21:24.310Z",
  "expectedTargetCount": 18,
  "expectedSourceRepositoryCount": 100,
  "expectedPublicRepositoryCount": 112,
  "statusVocabulary": {
    "target": [
      "PROPOSED",
      "REHEARSAL",
      "READY",
      "RELEASED",
      "VERIFIED",
      "ROLLED_BACK"
    ],
    "source": [
      "ACTIVE_SOURCE",
      "ACTIVE_TARGET",
      "FROZEN_SOURCE",
      "MIGRATION_IN_PROGRESS",
      "TARGET_RELEASED",
      "REDIRECTED",
      "ARCHIVE_CANDIDATE",
      "ARCHIVE_APPROVED",
      "ARCHIVED",
      "ROLLED_BACK"
    ],
    "evidence": [
      "OBSERVED",
      "CALCULATED",
      "INFERRED",
      "NOT_PROVEN",
      "BLOCKED",
      "VERIFIED"
    ],
    "gate": [
      "PASS",
      "BLOCKED",
      "NOT_RUN",
      "WAIVED"
    ]
  },
  "standaloneRepositories": [
    {
      "repository": "apprentice-ai",
      "state": "DECISION_REQUIRED",
      "decision": "KEEP_STANDALONE_OR_IMPORT_AGENTOPS",
      "owner": "vigilanty0x",
      "evidenceStatus": "OBSERVED"
    },
    {
      "repository": "shipcheck-release-gate",
      "state": "DECISION_REQUIRED",
      "decision": "MERGE_AS_SHIPCHECK_PACKAGE_OR_PROVE_DISTINCT_RELEASE_PERSONA",
      "owner": "vigilanty0x",
      "evidenceStatus": "OBSERVED"
    }
  ],
  "archiveBatches": [
    {
      "id": "promptops-2026-09-06",
      "target": "promptops",
      "status": "OBSERVED_NONCOMPLIANT",
      "sourceEvidence": {
        "repository": "promptops",
        "commit": "d1b76b180d64b655d1fcd76df13427f66e5a8ce0",
        "compatibilityManifestUrl": "https://github.com/vigilanty0x/promptops/blob/d1b76b180d64b655d1fcd76df13427f66e5a8ce0/portfolio-compatibility.v1.json",
        "governanceManifestUrl": "https://github.com/vigilanty0x/promptops/blob/d1b76b180d64b655d1fcd76df13427f66e5a8ce0/repository-governance.v1.json"
      },
      "approval": {
        "approver": "vigilanty0x",
        "approvedOn": "2026-09-06",
        "action": "ARCHIVE_ONLY_NO_DELETION",
        "evidenceUrl": "https://github.com/vigilanty0x/promptops/blob/d1b76b180d64b655d1fcd76df13427f66e5a8ce0/portfolio-compatibility.v1.json",
        "repositories": [
          "answer-diff",
          "benchmark-run-recorder",
          "consensus-engine",
          "eval-dataset-builder",
          "llm-jury",
          "model-scorecard",
          "multi-agent-failure-corpus",
          "prompt-package-manager",
          "prompt-regression"
        ]
      },
      "consumerInventory": {
        "status": "VERIFIED",
        "runId": 34038891620,
        "runUrl": "https://github.com/vigilanty0x/.github/actions/runs/34038891620",
        "artifactId": 9991044854,
        "artifactDigestSha256": "4b27986b96b04f2decffe047442e21f2605dad40cbb964ae8513fd9b2503ee26",
        "evidenceSha256": "7cea37067c023dea175ecbd1c872a97cca0ce055a4a6cc3fea0140a830873911",
        "observedAt": "2026-09-06T14:21:24.310Z",
        "expiresAt": "2026-10-06T14:21:24.310Z",
        "repositories": [
          "answer-diff",
          "benchmark-run-recorder",
          "consensus-engine",
          "eval-dataset-builder",
          "llm-jury",
          "model-scorecard",
          "multi-agent-failure-corpus",
          "prompt-package-manager",
          "prompt-regression"
        ],
        "externalConsumerRepositories": [],
        "limitation": "The bounded public default-branch scan cannot observe private, local, cached, package-index, dynamic, or third-party consumers."
      },
      "releaseVerification": {
        "status": "VERIFIED",
        "version": "0.5.0",
        "tag": "v0.5.0",
        "url": "https://github.com/vigilanty0x/promptops/releases/tag/v0.5.0",
        "sourceSha": "c8c6d133e86a119338edbc7b4e9142ce1c525fb5",
        "artifactName": "promptbench_replay-0.5.0-py3-none-any.whl",
        "artifactSha256": "ee91c9f0cf84d928f4119d1125b0393bc8dc57a972e6316b9da659e5b27aaedb",
        "publishedAt": "2026-08-18T03:13:07Z",
        "verificationRunId": 32094998702,
        "verificationUrl": "https://github.com/vigilanty0x/promptops/actions/runs/32094998702"
      },
      "rollback": {
        "status": "DOCUMENTED",
        "lastRehearsedAt": null,
        "evidenceUrl": "https://github.com/vigilanty0x/promptops/blob/d1b76b180d64b655d1fcd76df13427f66e5a8ce0/docs/PORTFOLIO-COMPATIBILITY-AND-ARCHIVE-GATE.md#rollback",
        "method": "The documented recovery path restores development from the preserved immutable source commits, but no executed rollback rehearsal is recorded."
      },
      "serverReadback": {
        "observedAt": "2026-09-06T14:51:35.617Z",
        "evidenceUrl": "https://github.com/vigilanty0x/promptops/blob/d1b76b180d64b655d1fcd76df13427f66e5a8ce0/repository-governance.v1.json",
        "archiveOnlyNoDeletion": true,
        "repositories": [
          {
            "repository": "answer-diff",
            "archived": true,
            "headSha": "5c51cdf22afd2e9c55b59b888b1a60ff1b4b3d54",
            "homepage": "https://github.com/vigilanty0x/promptops/tree/main/packages/answer-diff",
            "openPullRequestCount": 0,
            "redirect": {
              "pullRequest": 2,
              "mergeSha": "5c51cdf22afd2e9c55b59b888b1a60ff1b4b3d54",
              "path": "README.md",
              "ci": "SUCCESS"
            }
          },
          {
            "repository": "benchmark-run-recorder",
            "archived": true,
            "headSha": "c0bfff75d2237bb48b95efa3389fdb6b4c45ccdc",
            "homepage": "https://github.com/vigilanty0x/promptops/tree/main/packages/benchmark-run-recorder",
            "openPullRequestCount": 0,
            "redirect": {
              "pullRequest": 2,
              "mergeSha": "c0bfff75d2237bb48b95efa3389fdb6b4c45ccdc",
              "path": "README.md",
              "ci": "SUCCESS"
            }
          },
          {
            "repository": "consensus-engine",
            "archived": true,
            "headSha": "5239acbb56d271f86c01162c17c04d1875e83df8",
            "homepage": "https://github.com/vigilanty0x/promptops/tree/main/packages/consensus-engine",
            "openPullRequestCount": 0,
            "redirect": {
              "pullRequest": 2,
              "mergeSha": "5239acbb56d271f86c01162c17c04d1875e83df8",
              "path": "README.md",
              "ci": "SUCCESS"
            }
          },
          {
            "repository": "eval-dataset-builder",
            "archived": true,
            "headSha": "7bbef9d75115ccc406cc47554cc77e22300c1385",
            "homepage": "https://github.com/vigilanty0x/promptops/tree/main/packages/eval-dataset-builder",
            "openPullRequestCount": 0,
            "redirect": {
              "pullRequest": 2,
              "mergeSha": "7bbef9d75115ccc406cc47554cc77e22300c1385",
              "path": "README.md",
              "ci": "SUCCESS"
            }
          },
          {
            "repository": "llm-jury",
            "archived": true,
            "headSha": "49d5fc90be79661721c8a89797aafd50bb5fa069",
            "homepage": "https://github.com/vigilanty0x/promptops/tree/main/packages/llm-jury",
            "openPullRequestCount": 0,
            "redirect": {
              "pullRequest": 2,
              "mergeSha": "49d5fc90be79661721c8a89797aafd50bb5fa069",
              "path": "README.md",
              "ci": "SUCCESS"
            }
          },
          {
            "repository": "model-scorecard",
            "archived": true,
            "headSha": "203870578fac187e97ff6854ea041bd16f815c8b",
            "homepage": "https://github.com/vigilanty0x/promptops/tree/main/packages/model-scorecard",
            "openPullRequestCount": 0,
            "redirect": {
              "pullRequest": 2,
              "mergeSha": "203870578fac187e97ff6854ea041bd16f815c8b",
              "path": "README.md",
              "ci": "SUCCESS"
            }
          },
          {
            "repository": "multi-agent-failure-corpus",
            "archived": true,
            "headSha": "b541a772943d63d5a37a0dccf3d4631f843885f4",
            "homepage": "https://github.com/vigilanty0x/promptops/tree/main/packages/multi-agent-failure-corpus",
            "openPullRequestCount": 0,
            "redirect": {
              "pullRequest": 2,
              "mergeSha": "b541a772943d63d5a37a0dccf3d4631f843885f4",
              "path": "README.md",
              "ci": "SUCCESS"
            }
          },
          {
            "repository": "prompt-package-manager",
            "archived": true,
            "headSha": "cff0de7a8a37d992d0079341955f79ca8801ce77",
            "homepage": "https://github.com/vigilanty0x/promptops/tree/main/packages/prompt-package-manager",
            "openPullRequestCount": 0,
            "redirect": {
              "pullRequest": 2,
              "mergeSha": "cff0de7a8a37d992d0079341955f79ca8801ce77",
              "path": "README.md",
              "ci": "SUCCESS"
            }
          },
          {
            "repository": "prompt-regression",
            "archived": true,
            "headSha": "d877d4487c3322b3cdb68d51b085e1185efcf50d",
            "homepage": "https://github.com/vigilanty0x/promptops/tree/main/packages/prompt-regression",
            "openPullRequestCount": 0,
            "redirect": {
              "pullRequest": 2,
              "mergeSha": "d877d4487c3322b3cdb68d51b085e1185efcf50d",
              "path": "README.md",
              "ci": "SUCCESS"
            }
          }
        ]
      },
      "compliance": {
        "status": "BLOCKED",
        "requiredGates": {
          "decision": "PASS",
          "import": "PASS",
          "compatibility": "PASS",
          "release": "PASS",
          "consumers": "PASS",
          "redirect": "BLOCKED",
          "rollback": "BLOCKED",